{
  "schema_version": "build-evidence.v1",
  "producer": "pipeline/evidence.py",
  "source_input": {
    "dataset_slug": "bank-marketing",
    "release_id": "release-20260620-002",
    "path": "bank-marketing-source-input.json"
  },
  "publisher_validation": {
    "valid": true,
    "validation_outcome": "accepted",
    "validated_at": "2026-06-20T21:23:21+00:00"
  },
  "build_boundary_confirmations": {
    "promotion_occurred": false,
    "registry_mutation_occurred": false
  },
  "evidence_policy": {
    "raw_logs_prohibited": true,
    "raw_runtime_prohibited": true,
    "raw_api_payloads_prohibited": true,
    "secrets_prohibited": true,
    "private_source_paths_prohibited": true,
    "reduced_and_sanitized": true
  },
  "assembled_artifacts": [
    "contracts/runtime-contract.json",
    "contracts/public-contract.json",
    "metrics/metrics.json",
    "predictions/bundle.json",
    "model-card.json",
    "public-context.json",
    "manifest-input.json",
    "release-candidate.json"
  ]
}